{
  "schema": "gates",
  "run": "20261007-103559-verify",
  "computed_at": "2026-10-07T14:40:25.415Z",
  "criteria": {
    "EVD-01": {
      "state": "pass",
      "detail": "manifest complete",
      "evidence": [
        "manifest.json"
      ],
      "gate": "G0",
      "title": "Run manifest is complete: tool and engine versions, URL and commit or content hash, viewport matrix, emulations, timestamps, evaluator providers and models, depth",
      "advisory": false,
      "required_for": null,
      "optional": false
    },
    "EVD-02": {
      "state": "pass",
      "detail": "smoke test passed at 2026-10-07T14:34:55.000Z",
      "evidence": [
        ".ui-evaluator/doctor.json"
      ],
      "gate": "G0",
      "title": "Doctor smoke test passed in this session: each tool produced the expected detections on the known-bad fixture",
      "advisory": false,
      "required_for": null,
      "optional": false
    },
    "EVD-03": {
      "state": "pass",
      "detail": "46 valid capture(s)",
      "evidence": [
        "manifest.json"
      ],
      "gate": "G0",
      "title": "Capture validity: no blank or near-uniform captures, correct dimensions, fonts loaded, animations settled, full-page captures start at the top",
      "advisory": false,
      "required_for": null,
      "optional": false
    },
    "EVD-04": {
      "state": "pass",
      "detail": "every criterion has an explicit state with a reason",
      "evidence": [],
      "gate": "G0",
      "title": "Every criterion has an explicit state backed by artifacts; `not_run` is never shown as pass; the WCAG coverage matrix is present",
      "advisory": false,
      "required_for": null,
      "optional": false
    },
    "EVD-05": {
      "state": "pass",
      "detail": "114 finding(s) anchored",
      "evidence": [],
      "gate": "G0",
      "title": "Every reported finding has a resolvable evidence anchor (selector resolves in the captured state, or a crop exists)",
      "advisory": false,
      "required_for": null,
      "optional": false
    },
    "EVD-06": {
      "state": "pass",
      "detail": "report language matches evidence levels",
      "evidence": [
        "report-lint.json"
      ],
      "gate": "G0",
      "title": "Report language matches evidence levels: no \"users …\" claims below E3, no causal claims below E5, no completeness claims, no synthetic metrics",
      "advisory": false,
      "required_for": null,
      "optional": false
    },
    "EVD-07": {
      "state": "pass",
      "detail": "1 evaluator(s) recorded with isolation and model",
      "evidence": [],
      "gate": "G0",
      "title": "Independence is recorded per evaluator (context isolation, provider, model, inputs given); DEGRADED banner present where isolation was not achieved",
      "advisory": false,
      "required_for": null,
      "optional": false
    },
    "EVD-08": {
      "state": "pass",
      "detail": "no stale findings reported",
      "evidence": [],
      "gate": "G0",
      "title": "Freshness: every finding's fingerprint matches the current UI version, or the finding is marked `stale`",
      "advisory": false,
      "required_for": null,
      "optional": false
    },
    "FUN-01": {
      "state": "pass",
      "detail": "no findings",
      "evidence": [],
      "gate": "G1",
      "title": "Every in-scope route loads (2xx) and renders its main content within the timeout",
      "advisory": false,
      "required_for": null,
      "optional": false
    },
    "FUN-02": {
      "state": "pass",
      "detail": "no findings",
      "evidence": [],
      "gate": "G1",
      "title": "No uncaught exceptions or console errors during load and journey replay; console parity vs baseline",
      "advisory": false,
      "required_for": null,
      "optional": false
    },
    "FUN-03": {
      "state": "pass",
      "detail": "1 critical journey(s) replayed to their success condition",
      "evidence": [],
      "gate": "G1",
      "title": "Every declared critical journey completes by scripted replay to its success condition",
      "advisory": false,
      "required_for": null,
      "optional": false
    },
    "FUN-04": {
      "state": "pass",
      "detail": "no findings",
      "evidence": [],
      "gate": "G1",
      "title": "No broken images or media (`naturalWidth = 0`, failed requests) and no broken in-scope links",
      "advisory": false,
      "required_for": null,
      "optional": false
    },
    "FUN-05": {
      "state": "pass",
      "detail": "no findings",
      "evidence": [],
      "gate": "G1",
      "title": "No horizontal page overflow at any matrix width (`scrollWidth ≤ clientWidth + 1`), except declared 2-D regions (data tables, maps, code)",
      "advisory": false,
      "required_for": null,
      "optional": false
    },
    "FUN-06": {
      "state": "pass",
      "detail": "no findings",
      "evidence": [],
      "gate": "G1",
      "title": "No clipped or overlapping text at rest at any matrix width (overflow-hidden element whose scroll size exceeds client size; intersecting text boxes)",
      "advisory": false,
      "required_for": null,
      "optional": false
    },
    "FUN-07": {
      "state": "pass",
      "detail": "no findings",
      "evidence": [],
      "gate": "G1",
      "title": "Lab Cumulative Layout Shift over load + scripted interactions",
      "advisory": false,
      "required_for": null,
      "optional": false
    },
    "FUN-08": {
      "state": "pass",
      "detail": "no findings",
      "evidence": [],
      "gate": "G1",
      "title": "Lab LCP ≤ 2.5 s and INP ≤ 200 ms",
      "advisory": true,
      "required_for": null,
      "optional": false
    },
    "A11Y-01": {
      "state": "pass",
      "detail": "no findings",
      "evidence": [],
      "gate": "G2",
      "title": "axe-core with tags `wcag2a`, `wcag2aa`, `wcag21a`, `wcag21aa`, `wcag22aa` over all in-scope states × {320, 1280} × shipped themes",
      "advisory": false,
      "required_for": null,
      "optional": false
    },
    "A11Y-02": {
      "state": "not_run",
      "detail": "10 incomplete result(s); the accessibility auditor has not run",
      "evidence": [],
      "awaiting_judgement": true,
      "gate": "G2",
      "title": "Every axe `incomplete` result is resolved by a scripted check or the accessibility auditor",
      "advisory": false,
      "required_for": null,
      "optional": false
    },
    "A11Y-03": {
      "state": "pass",
      "detail": "no findings",
      "evidence": [],
      "gate": "G2",
      "title": "Keyboard: every interactive element is reachable; no trap; focus order follows visual order; no context change on focus",
      "advisory": false,
      "required_for": null,
      "optional": false
    },
    "A11Y-04": {
      "state": "pass",
      "detail": "no findings",
      "evidence": [],
      "gate": "G2",
      "title": "Focus visible: every tab stop produces a visible change (focused vs blurred crop diff)",
      "advisory": false,
      "required_for": null,
      "optional": false
    },
    "A11Y-05": {
      "state": "pass",
      "detail": "no findings",
      "evidence": [],
      "gate": "G2",
      "title": "Focus not obscured: the focused element is not entirely hidden by author content (Tab and Shift+Tab)",
      "advisory": false,
      "required_for": null,
      "optional": false
    },
    "A11Y-06": {
      "state": "not_applicable",
      "detail": "no modal dialog in scope (dialogs check found none to exercise)",
      "evidence": [],
      "gate": "G2",
      "title": "Modal dialogs: focus moves in, Tab wraps inside, Esc closes, focus returns to the invoker; correct dialog semantics",
      "advisory": false,
      "required_for": null,
      "optional": false
    },
    "A11Y-07": {
      "state": "pass",
      "detail": "no findings",
      "evidence": [],
      "gate": "G2",
      "title": "Reflow at 320 CSS px without two-dimensional scrolling (except 2-D content)",
      "advisory": false,
      "required_for": null,
      "optional": false
    },
    "A11Y-08": {
      "state": "pass",
      "detail": "no findings",
      "evidence": [],
      "gate": "G2",
      "title": "Text-spacing override (line-height 1.5, paragraph spacing 2em, letter 0.12em, word 0.16em) causes no clipping or overlap",
      "advisory": false,
      "required_for": null,
      "optional": false
    },
    "A11Y-09": {
      "state": "pass",
      "detail": "no findings",
      "evidence": [],
      "gate": "G2",
      "title": "200% text resize: no clipping or overlap; controls operable",
      "advisory": false,
      "required_for": null,
      "optional": false
    },
    "A11Y-10": {
      "state": "pass",
      "detail": "no findings",
      "evidence": [],
      "gate": "G2",
      "title": "Targets ≥ 24 × 24 CSS px unless an SC 2.5.8 exception applies (spacing circle, equivalent, inline, user-agent, essential)",
      "advisory": false,
      "required_for": null,
      "optional": false
    },
    "A11Y-11": {
      "state": "pass",
      "detail": "no findings",
      "evidence": [],
      "gate": "G2",
      "title": "Text contrast ≥ 4.5:1; large text (≥ 24 px, or ≥ 18.66 px bold) ≥ 3:1; computed on the composited background in every state and theme; text over images or gradients pixel-sampled. CJK text from 18 to 24 px that is not already large text by the bold rule, with contrast between 3:1 and 4.5:1, goes to the accessibility auditor instead of being auto-passed or auto-failed, and 1.4.3 is recorded as agent-judged whenever such text is in scope (ADR-032)",
      "advisory": false,
      "required_for": null,
      "optional": false
    },
    "A11Y-12": {
      "state": "pass",
      "detail": "no findings",
      "evidence": [],
      "gate": "G2",